{
  "$schema": "../../../../schema/pack.schema.json",
  "schemaVersion": 2,
  "id": "aion2/asmodian/ranger",
  "kind": "guide",
  "name": "Asmodian Ranger leveling guide",
  "parent": "aion2/asmodian/guide",
  "uses": ["aion2/classes/ranger"],
  "files": ["builds.json", "retired.json", "guide/milestones.json", "guide/steps.json", "guide/tips.json", "guide/claims.json", "guide/confidence.json"]
}
