{
  "$schema": "../../../../schema/pack.schema.json",
  "schemaVersion": 2,
  "id": "aion2/asmodian/gladiator",
  "kind": "guide",
  "name": "Asmodian Gladiator leveling guide",
  "parent": "aion2/asmodian/guide",
  "uses": ["aion2/classes/gladiator"],
  "files": ["builds.json", "retired.json", "guide/milestones.json", "guide/steps.json", "guide/tips.json", "guide/claims.json", "guide/confidence.json"]
}
